{
  "dcp_version": "2.0",
  "dispute_id": "dispute:res-conflict-2026-042",
  "session_nonce": "a1b2c3d4e5f6a1b2c3d4e5f6a1b2c3d4e5f6a1b2c3d4e5f6a1b2c3d4e5f6a1b2",
  "initiator_agent_id": "agent:research-bot-v2-001",
  "respondent_agent_id": "agent:data-pipeline-bot-003",
  "dispute_type": "resource_conflict",
  "evidence_hashes": [
    "aabb01020304050607080910aabb01020304050607080910aabb01020304050607",
    "ccdd01020304050607080910ccdd01020304050607080910ccdd01020304050607"
  ],
  "escalation_level": "contextual_arbitration",
  "status": "open",
  "timestamp": "2026-03-15T14:22:00Z",
  "composite_sig": {
    "classical": { "alg": "ed25519", "kid": "a1b2c3d4e5f6a1b2c3d4e5f6a1b2c3d4", "sig_b64": "dGVzdHNpZzEyMzQ1Njc4OTAxMjM0NTY=" },
    "pq": { "alg": "ml-dsa-65", "kid": "d4e5f6a1b2c3d4e5f6a1b2c3d4e5f6a1", "sig_b64": "dGVzdHBxc2lnMTIzNDU2Nzg5MDEyMzQ1Ng==" },
    "binding": "pq_over_classical"
  }
}
